{
  "$schema": "https://json-schema.org/draft/2020-12/schema",
  "$id": "https://www.saltdesignsystem.com/schemas/salt-public-package-docs-v1.json",
  "title": "Salt public package documentation inventory v1",
  "type": "object",
  "additionalProperties": false,
  "required": ["schema_version", "authoring_baseline", "support_destinations", "remediation_worklist", "packages"],
  "properties": {
    "schema_version": { "const": "1.0.0" },
    "authoring_baseline": {
      "type": "object",
      "additionalProperties": false,
      "required": ["checkpoint_sha", "policy"],
      "properties": {
        "checkpoint_sha": { "type": "string", "pattern": "^[0-9a-f]{40}$" },
        "policy": { "const": "no-new-deficits" }
      }
    },
    "support_destinations": {
      "type": "object",
      "additionalProperties": false,
      "required": ["public_salt_support", "none"],
      "properties": {
        "public_salt_support": {
          "type": "string",
          "format": "uri",
          "pattern": "^https://www\\.saltdesignsystem\\.com/salt/support-and-contributions$"
        },
        "none": { "type": "null" }
      }
    },
    "remediation_worklist": {
      "type": "array",
      "items": {
        "type": "object",
        "additionalProperties": false,
        "required": ["name", "due_unit", "deficits", "owner"],
        "properties": {
          "name": { "type": "string", "pattern": "^@salt-ds/" },
          "due_unit": { "enum": ["06d", "08c"] },
          "deficits": {
            "type": "array",
            "minItems": 0,
            "uniqueItems": true,
            "items": {
              "enum": [
                "readme",
                "description",
                "homepage",
                "keywords",
                "bugs",
                "packed_readme"
              ]
            }
          },
          "owner": { "type": "string", "minLength": 1 }
        }
      }
    },
    "packages": {
      "type": "array",
      "minItems": 16,
      "maxItems": 16,
      "items": { "$ref": "#/$defs/package" }
    }
  },
  "$defs": {
    "owner": {
      "type": "object",
      "additionalProperties": false,
      "required": ["primary", "backup"],
      "properties": {
        "primary": { "type": "string", "minLength": 1 },
        "backup": { "type": "string", "minLength": 1 }
      }
    },
    "metadata": {
      "type": "object",
      "additionalProperties": false,
      "required": ["description", "license", "repository", "bugs", "keywords"],
      "properties": {
        "description": { "enum": ["present", "missing", "planned"] },
        "license": { "enum": ["present", "missing", "planned"] },
        "repository": { "enum": ["present", "missing", "planned"] },
        "bugs": { "enum": ["present", "missing", "planned"] },
        "keywords": { "enum": ["present", "missing", "planned"] }
      }
    },
    "package": {
      "type": "object",
      "additionalProperties": false,
      "required": [
        "name",
        "workspace_path",
        "lifecycle",
        "readme_path",
        "metadata_fields",
        "packed_readme_status",
        "owner",
        "support_destination"
      ],
      "properties": {
        "name": {
          "type": "string",
          "pattern": "^@salt-ds/[a-z0-9][a-z0-9._-]*$"
        },
        "workspace_path": {
          "anyOf": [
            { "type": "string", "pattern": "^packages/[a-z0-9][a-z0-9._-]*$" },
            { "type": "null" }
          ]
        },
        "lifecycle": { "enum": ["publishable", "planned", "conditional"] },
        "readme_path": {
          "type": "string",
          "pattern": "^packages/[a-z0-9][a-z0-9._-]*/README\\.md$"
        },
        "metadata_fields": { "$ref": "#/$defs/metadata" },
        "packed_readme_status": {
          "enum": ["present", "required_before_activation"]
        },
        "owner": { "$ref": "#/$defs/owner" },
        "support_destination": { "enum": ["public_salt_support", "none"] }
      }
    }
  }
}
